<?xml version="1.0" encoding="UTF-8"?>
<!DOCTYPE portafoglio SYSTEM "portafoglio.dtd">
<portafoglio valuta="€">
	<informazioni tolleranza="5" ultimoAggiornamento="20251125-11:19:10" commissione="5"/>
	<assets>
		<etf ticker="EACW.MI" valuta="€">
			<nome>EACW</nome>
			<target>20</target>
			<operazioni>
				<operazione>
					<data>20251127-11:02:46</data>
					<quantita>768</quantita>
					<prezzo>20.080000</prezzo>
				</operazione>
				<operazione>
					<data>20251127-11:03:10</data>
					<quantita>158</quantita>
					<prezzo>20.870000</prezzo>
				</operazione>
				<operazione>
					<data>20251127-11:03:26</data>
					<quantita>1064</quantita>
					<prezzo>18.790000</prezzo>
				</operazione>
				<operazione>
					<data>20251127-11:03:39</data>
					<quantita>99</quantita>
					<prezzo>20.060000</prezzo>
				</operazione>
				<operazione>
					<data>20251127-11:03:56</data>
					<quantita>153</quantita>
					<prezzo>20.925000</prezzo>
				</operazione>
				<operazione>
					<data>20251127-11:04:17</data>
					<quantita>225</quantita>
					<prezzo>22.120000</prezzo>
				</operazione>
				<operazione>
					<data>20251127-11:04:54</data>
					<quantita>109</quantita>
					<prezzo>23.080000</prezzo>
				</operazione>
			</operazioni>
		</etf>
		<etf ticker="CSEMUS.MI" valuta="€">
			<nome>EU small cap</nome>
			<target>20</target>
			<operazioni/>
		</etf>
		<etf ticker="GBSE.MI" valuta="€">
			<nome>Oro hedged</nome>
			<target>20</target>
			<operazioni>
				<operazione>
					<data>20251127-10:59:40</data>
					<quantita>549</quantita>
					<prezzo>14.546000</prezzo>
				</operazione>
				<operazione>
					<data>20251127-11:00:11</data>
					<quantita>192</quantita>
					<prezzo>15.650000</prezzo>
				</operazione>
				<operazione>
					<data>20251127-11:00:27</data>
					<quantita>553</quantita>
					<prezzo>18.090000</prezzo>
				</operazione>
				<operazione>
					<data>20251127-11:00:46</data>
					<quantita>222</quantita>
					<prezzo>17.916000</prezzo>
				</operazione>
			</operazioni>
		</etf>
		<bucket valuta="€">
			<nome>LongTermBonds</nome>
			<target>20</target>
			<obbligazione ticker="IT0005534141" tradeStep="1000" valuta="€" taxRate="12.5">
				<nome>BTP 01OT53 4.50% D30</nome>
				<target>70</target>
				<operazioni>
					<operazione>
						<data>20251127-10:55:20</data>
						<quantita>26000</quantita>
						<prezzo>100.892610</prezzo>
					</operazione>
				</operazioni>
			</obbligazione>
			<obbligazione ticker="IT0004532559" tradeStep="1000" valuta="€">
				<nome>BTP-01ST40 5,00% D30</nome>
				<target>30</target>
				<operazioni>
					<operazione>
						<data>20251127-10:55:46</data>
						<quantita>9000</quantita>
						<prezzo>99.978210</prezzo>
					</operazione>
				</operazioni>
			</obbligazione>
		</bucket>
		<bucket valuta="€">
			<nome>ShortTermBonds</nome>
			<target>20</target>
			<obbligazione ticker="IT0005240830" tradeStep="1000" valuta="€">
				<nome>BTP-01GN27</nome>
				<target>17</target>
				<operazioni>
					<operazione>
						<data>20251127-10:56:17</data>
						<quantita>25000</quantita>
						<prezzo>95.808560</prezzo>
					</operazione>
				</operazioni>
			</obbligazione>
			<obbligazione ticker="IT0005521981" tradeStep="1000" valuta="€">
				<nome>BTP-01APR28 3.40%</nome>
				<target>17</target>
				<operazioni>
					<operazione>
						<data>20251127-10:56:48</data>
						<quantita>17000</quantita>
						<prezzo>99.748464</prezzo>
					</operazione>
				</operazioni>
			</obbligazione>
			<obbligazione ticker="IT0005514473" tradeStep="1000" valuta="€">
				<nome>BTP-15GE26 3.50%</nome>
				<target>17</target>
				<operazioni>
					<operazione>
						<data>20251127-10:57:15</data>
						<quantita>13000</quantita>
						<prezzo>100.964376</prezzo>
					</operazione>
				</operazioni>
			</obbligazione>
			<obbligazione ticker="IT0005428617" tradeStep="1000" valuta="€">
				<nome>CCTEU-AP26 TV EUR</nome>
				<target>17</target>
				<operazioni>
					<operazione>
						<data>20251127-10:57:38</data>
						<quantita>12000</quantita>
						<prezzo>100.606166</prezzo>
					</operazione>
				</operazioni>
			</obbligazione>
			<obbligazione ticker="IT0005547408" tradeStep="1000" valuta="€">
				<nome>BTPVAL 13GN27 SU CUM</nome>
				<target>16</target>
				<operazioni>
					<operazione>
						<data>20251127-10:58:03</data>
						<quantita>10000</quantita>
						<prezzo>100.000000</prezzo>
					</operazione>
				</operazioni>
			</obbligazione>
			<obbligazione ticker="IT0005532723" tradeStep="1000" valuta="€">
				<nome>BTPIT 14MZ28 2,00ORD</nome>
				<target>16</target>
				<operazioni>
					<operazione>
						<data>20251127-10:58:38</data>
						<quantita>10000</quantita>
						<prezzo>101.160600</prezzo>
					</operazione>
				</operazioni>
			</obbligazione>
		</bucket>
	</assets>
	<liquidita>
		<totale>2000.00</totale>
	</liquidita>
</portafoglio>
